{
  "$schema": "./cards.schema.json",
  "format": "naruto-tcg-simulator/cards@1",
  "generatedAt": "2026-10-14",
  "source": "Original seed set for the simulator. Replace or extend with scraped data using the same schema.",
  "cards": [
    {
      "id": "SIM-001",
      "name": "Naruto Uzumaki",
      "title": "Knucklehead Genin",
      "set": "SIM",
      "setName": "Shinobi Simulator Seed Set",
      "number": "001/137",
      "type": "character",
      "rarity": "common",
      "element": "wind",
      "village": "Leaf Village",
      "keywords": [
        "Team 7",
        "Jinchuriki"
      ],
      "cost": 2,
      "power": 1,
      "text": "MAIN: Put the top card of your deck into this mission as a hidden character.",
      "flavor": "Believe it!",
      "imageUrl": null
    },
    {
      "id": "SIM-002",
      "name": "Naruto Uzumaki",
      "title": "Shadow Clone Barrage",
      "set": "SIM",
      "setName": "Shinobi Simulator Seed Set",
      "number": "002/137",
      "type": "character",
      "rarity": "rare",
      "element": "wind",
      "village": "Leaf Village",
      "keywords": [
        "Team 7",
        "Jinchuriki"
      ],
      "cost": 4,
      "power": 4,
      "text": "MAIN: POWERUP 1 on each other friendly character in this mission.\nUPGRADE: POWERUP 2.",
      "imageUrl": null
    },
    {
      "id": "SIM-003",
      "name": "Naruto Uzumaki",
      "title": "Sage Mode",
      "set": "SIM",
      "setName": "Shinobi Simulator Seed Set",
      "number": "003/137",
      "type": "character",
      "rarity": "super-rare",
      "element": "wind",
      "village": "Leaf Village",
      "keywords": [
        "Team 7",
        "Jinchuriki",
        "Sage"
      ],
      "cost": 6,
      "power": 6,
      "text": "UPGRADE: POWERUP 2 on each other friendly character in this mission.\nCONTINUOUS: This character gets +2 Power while you hold the Edge token.",
      "imageUrl": null
    },
    {
      "id": "SIM-004",
      "name": "Sasuke Uchiha",
      "title": "Last of the Uchiha",
      "set": "SIM",
      "setName": "Shinobi Simulator Seed Set",
      "number": "004/137",
      "type": "character",
      "rarity": "common",
      "element": "fire",
      "village": "Leaf Village",
      "keywords": [
        "Team 7",
        "Uchiha"
      ],
      "cost": 2,
      "power": 2,
      "text": "MAIN: If you control another Team 7 character in this mission, POWERUP 1.",
      "imageUrl": null
    },
    {
      "id": "SIM-005",
      "name": "Sasuke Uchiha",
      "title": "Chidori",
      "set": "SIM",
      "setName": "Shinobi Simulator Seed Set",
      "number": "005/137",
      "type": "character",
      "rarity": "rare",
      "element": "lightning",
      "village": "Leaf Village",
      "keywords": [
        "Team 7",
        "Uchiha"
      ],
      "cost": 4,
      "power": 4,
      "text": "MAIN: Defeat the weakest enemy character in this mission with Power 2 or less.",
      "imageUrl": null
    },
    {
      "id": "SIM-006",
      "name": "Sasuke Uchiha",
      "title": "Cursed Seal",
      "set": "SIM",
      "setName": "Shinobi Simulator Seed Set",
      "number": "006/137",
      "type": "character",
      "rarity": "super-rare",
      "element": "yin",
      "village": "Sound Village",
      "keywords": [
        "Uchiha"
      ],
      "cost": 6,
      "power": 7,
      "text": "AMBUSH: Defeat the strongest enemy character in this mission with Power 5 or less.\nUPGRADE: Draw 1 card.",
      "imageUrl": null
    },
    {
      "id": "SIM-007",
      "name": "Sakura Haruno",
      "title": "Determined Kunoichi",
      "set": "SIM",
      "setName": "Shinobi Simulator Seed Set",
      "number": "007/137",
      "type": "character",
      "rarity": "common",
      "element": "yang",
      "village": "Leaf Village",
      "keywords": [
        "Team 7",
        "Medical"
      ],
      "cost": 1,
      "power": 1,
      "text": "MAIN: POWERUP 1 on your weakest character in this mission.",
      "imageUrl": null
    },
    {
      "id": "SIM-008",
      "name": "Sakura Haruno",
      "title": "Cherry Blossom Impact",
      "set": "SIM",
      "setName": "Shinobi Simulator Seed Set",
      "number": "008/137",
      "type": "character",
      "rarity": "uncommon",
      "element": "yang",
      "village": "Leaf Village",
      "keywords": [
        "Team 7",
        "Medical"
      ],
      "cost": 3,
      "power": 3,
      "text": "MAIN: POWERUP 2.\nUPGRADE: Draw 1 card.",
      "imageUrl": null
    },
    {
      "id": "SIM-009",
      "name": "Kakashi Hatake",
      "title": "Copy Ninja",
      "set": "SIM",
      "setName": "Shinobi Simulator Seed Set",
      "number": "009/137",
      "type": "character",
      "rarity": "rare",
      "element": "lightning",
      "village": "Leaf Village",
      "keywords": [
        "Team 7",
        "Jonin"
      ],
      "cost": 3,
      "power": 3,
      "text": "CONTINUOUS: Other friendly characters in this mission get +1 Power.",
      "imageUrl": null
    },
    {
      "id": "SIM-010",
      "name": "Kakashi Hatake",
      "title": "Lightning Blade",
      "set": "SIM",
      "setName": "Shinobi Simulator Seed Set",
      "number": "010/137",
      "type": "character",
      "rarity": "super-rare",
      "element": "lightning",
      "village": "Leaf Village",
      "keywords": [
        "Jonin",
        "Anbu"
      ],
      "cost": 5,
      "power": 5,
      "text": "MAIN: Defeat the weakest enemy character in this mission with Power 4 or less.\nUPGRADE: Take the Edge token.",
      "imageUrl": null
    },
    {
      "id": "SIM-011",
      "name": "Rock Lee",
      "title": "Taijutsu Prodigy",
      "set": "SIM",
      "setName": "Shinobi Simulator Seed Set",
      "number": "011/137",
      "type": "character",
      "rarity": "common",
      "element": "neutral",
      "village": "Leaf Village",
      "keywords": [
        "Team Guy"
      ],
      "cost": 2,
      "power": 3,
      "text": "",
      "flavor": "No ninjutsu, no genjutsu. Only will.",
      "imageUrl": null
    },
    {
      "id": "SIM-012",
      "name": "Rock Lee",
      "title": "Gates Unleashed",
      "set": "SIM",
      "setName": "Shinobi Simulator Seed Set",
      "number": "012/137",
      "type": "character",
      "rarity": "rare",
      "element": "neutral",
      "village": "Leaf Village",
      "keywords": [
        "Team Guy"
      ],
      "cost": 4,
      "power": 5,
      "text": "MAIN: If you hold the Edge token, POWERUP 2.",
      "imageUrl": null
    },
    {
      "id": "SIM-013",
      "name": "Might Guy",
      "title": "Blue Beast",
      "set": "SIM",
      "setName": "Shinobi Simulator Seed Set",
      "number": "013/137",
      "type": "character",
      "rarity": "rare",
      "element": "neutral",
      "village": "Leaf Village",
      "keywords": [
        "Team Guy",
        "Jonin"
      ],
      "cost": 5,
      "power": 5,
      "text": "CONTINUOUS: Friendly Team Guy characters in this mission get +1 Power.",
      "imageUrl": null
    },
    {
      "id": "SIM-014",
      "name": "Neji Hyuga",
      "title": "Byakugan Genius",
      "set": "SIM",
      "setName": "Shinobi Simulator Seed Set",
      "number": "014/137",
      "type": "character",
      "rarity": "uncommon",
      "element": "yang",
      "village": "Leaf Village",
      "keywords": [
        "Team Guy",
        "Hyuga"
      ],
      "cost": 3,
      "power": 2,
      "text": "MAIN: Defeat an enemy hidden character in this mission.",
      "imageUrl": null
    },
    {
      "id": "SIM-015",
      "name": "Hinata Hyuga",
      "title": "Gentle Fist",
      "set": "SIM",
      "setName": "Shinobi Simulator Seed Set",
      "number": "015/137",
      "type": "character",
      "rarity": "common",
      "element": "yang",
      "village": "Leaf Village",
      "keywords": [
        "Team 8",
        "Hyuga"
      ],
      "cost": 2,
      "power": 2,
      "text": "MAIN: The strongest enemy character in this mission gets -1 Power this round.",
      "imageUrl": null
    },
    {
      "id": "SIM-016",
      "name": "Tenten",
      "title": "Weapon Specialist",
      "set": "SIM",
      "setName": "Shinobi Simulator Seed Set",
      "number": "016/137",
      "type": "character",
      "rarity": "common",
      "element": "neutral",
      "village": "Leaf Village",
      "keywords": [
        "Team Guy"
      ],
      "cost": 2,
      "power": 2,
      "text": "MAIN: Remove up to 2 Power tokens from the strongest enemy character in this mission.",
      "imageUrl": null
    },
    {
      "id": "SIM-017",
      "name": "Shikamaru Nara",
      "title": "Shadow Possession",
      "set": "SIM",
      "setName": "Shinobi Simulator Seed Set",
      "number": "017/137",
      "type": "character",
      "rarity": "uncommon",
      "element": "yin",
      "village": "Leaf Village",
      "keywords": [
        "Ino-Shika-Cho"
      ],
      "cost": 2,
      "power": 1,
      "text": "MAIN: The strongest enemy character in this mission gets -2 Power this round.",
      "imageUrl": null
    },
    {
      "id": "SIM-018",
      "name": "Shikamaru Nara",
      "title": "Tactical Genius",
      "set": "SIM",
      "setName": "Shinobi Simulator Seed Set",
      "number": "018/137",
      "type": "character",
      "rarity": "rare",
      "element": "yin",
      "village": "Leaf Village",
      "keywords": [
        "Ino-Shika-Cho",
        "Chunin"
      ],
      "cost": 4,
      "power": 3,
      "text": "MAIN: Take the Edge token.\nUPGRADE: Draw 2 cards.",
      "imageUrl": null
    },
    {
      "id": "SIM-019",
      "name": "Choji Akimichi",
      "title": "Expansion Jutsu",
      "set": "SIM",
      "setName": "Shinobi Simulator Seed Set",
      "number": "019/137",
      "type": "character",
      "rarity": "common",
      "element": "yang",
      "village": "Leaf Village",
      "keywords": [
        "Ino-Shika-Cho"
      ],
      "cost": 3,
      "power": 4,